{
  "schema_version": "pt.v1",
  "result_id": "res_01J9ZQ3K2K3H0Q9WQ0M9X7ABCD",
  "created_at": "2026-01-31T19:42:10Z",
  "document": {
    "contract_type": "independent_contractor_services_agreement",
    "title": "Independent Contractor Services Agreement",
    "jurisdiction_hint": "California, United States",
    "page_count": 7,
    "word_count": 3120,
    "confidence_notes": [
      "Text appears machine-readable (not a scanned image).",
      "Agreement references 'Exhibit A (Statement of Work)'; Exhibit A was not included in the provided file."
    ]
  },
  "sections": {
    "document_overview": {
      "heading": "Document Overview",
      "plain_summary": {
        "status": "found",
        "summary": "This agreement describes a services relationship where a contractor provides services to a company in exchange for a monthly fee. It includes confidentiality terms, an ownership/assignment approach for work product, and a dispute process tied to California law.",
        "quotes": [
          "Contractor will provide the Services described in this Agreement and in any Statement of Work.",
          "This Agreement will be governed by the laws of the State of California."
        ],
        "sources": [
          { "source_id": "src_main", "page": 1, "start_char": 420, "end_char": 620 },
          { "source_id": "src_main", "page": 6, "start_char": 1820, "end_char": 1920 }
        ]
      },
      "contract_purpose": {
        "status": "found",
        "summary": "It sets the terms for providing services and related obligations like confidentiality, ownership of work product, and how the relationship can end.",
        "quotes": ["Contractor agrees to perform the Services for Company."],
        "sources": [
          { "source_id": "src_main", "page": 1, "start_char": 250, "end_char": 330 }
        ]
      },
      "effective_date": {
        "status": "found",
        "summary": "The effective date is stated as March 1, 2026.",
        "quotes": ["Effective Date: March 1, 2026"],
        "sources": [
          { "source_id": "src_main", "page": 1, "start_char": 120, "end_char": 155 }
        ]
      },
      "overall_structure": {
        "status": "found",
        "summary": "The agreement includes sections on services, term and termination, payment, confidentiality, intellectual property, liability/indemnity, and governing law/disputes, with an external Statement of Work referenced for detailed scope.",
        "quotes": ["Exhibit A (Statement of Work) is incorporated by reference."],
        "sources": [
          { "source_id": "src_main", "page": 2, "start_char": 40, "end_char": 110 }
        ]
      }
    },
    "parties": {
      "heading": "Parties",
      "client": {
        "status": "found",
        "summary": "The client is Redwood Labs, Inc., a Delaware corporation.",
        "quotes": ["Redwood Labs, Inc., a Delaware corporation (\"Company\")"],
        "sources": [
          { "source_id": "src_main", "page": 1, "start_char": 160, "end_char": 230 }
        ]
      },
      "contractor": {
        "status": "found",
        "summary": "The contractor is Jordan Lee, an individual.",
        "quotes": ["Jordan Lee (\"Contractor\")"],
        "sources": [
          { "source_id": "src_main", "page": 1, "start_char": 232, "end_char": 270 }
        ]
      },
      "notice_addresses": {
        "status": "found",
        "summary": "A notices section lists mailing addresses and allows notice by email if sent to the listed addresses.",
        "quotes": [
          "Notices must be in writing and delivered to the addresses below.",
          "Notices may be sent by email to the addresses set forth below."
        ],
        "sources": [
          { "source_id": "src_main", "page": 6, "start_char": 1200, "end_char": 1500 }
        ]
      },
      "definitions_of_parties": {
        "status": "found",
        "summary": "The agreement defines the parties as 'Company' and 'Contractor'.",
        "quotes": ["(\"Company\")", "(\"Contractor\")"],
        "sources": [
          { "source_id": "src_main", "page": 1, "start_char": 175, "end_char": 275 }
        ]
      }
    },
    "term_and_termination": {
      "heading": "Term & Termination",
      "start_date": {
        "status": "found",
        "summary": "The term starts on the effective date (March 1, 2026).",
        "quotes": ["This Agreement begins on the Effective Date."],
        "sources": [
          { "source_id": "src_main", "page": 3, "start_char": 210, "end_char": 270 }
        ]
      },
      "end_date_or_auto_renewal": {
        "status": "not_clearly_stated",
        "summary": "The agreement says it continues month-to-month, but it is not fully clear whether there is any fixed end date because the referenced Statement of Work may contain timeline details.",
        "quotes": ["continues on a month-to-month basis unless terminated"],
        "sources": [
          { "source_id": "src_main", "page": 3, "start_char": 270, "end_char": 335 }
        ]
      },
      "termination_for_convenience": {
        "status": "found",
        "summary": "Either party may terminate for any reason with 14 days' written notice.",
        "quotes": ["Either party may terminate ... upon fourteen (14) days' written notice."],
        "sources": [
          { "source_id": "src_main", "page": 3, "start_char": 340, "end_char": 430 }
        ]
      },
      "termination_for_cause": {
        "status": "found",
        "summary": "A material breach can lead to termination if it is not cured within 10 days after written notice.",
        "quotes": ["material breach ... not cured within ten (10) days"],
        "sources": [
          { "source_id": "src_main", "page": 3, "start_char": 432, "end_char": 520 }
        ]
      },
      "post_termination_obligations": {
        "status": "found",
        "summary": "After termination, the contractor must return confidential information and the payment obligation continues for amounts earned through the termination date.",
        "quotes": [
          "Contractor will return or destroy Confidential Information upon request.",
          "Company will pay Contractor for Services performed through the termination date."
        ],
        "sources": [
          { "source_id": "src_main", "page": 3, "start_char": 525, "end_char": 680 },
          { "source_id": "src_main", "page": 4, "start_char": 920, "end_char": 1010 }
        ]
      }
    },
    "scope_of_services": {
      "heading": "Scope of Services",
      "services_description": {
        "status": "not_clearly_stated",
        "summary": "The agreement states that services are defined in a Statement of Work, but the detailed description is not included in the file provided.",
        "quotes": ["Services will be described in each Statement of Work (\"SOW\")."],
        "sources": [
          { "source_id": "src_main", "page": 2, "start_char": 120, "end_char": 200 }
        ]
      },
      "deliverables": {
        "status": "not_found",
        "summary": "Specific deliverables are not listed in the main agreement text.",
        "quotes": [],
        "sources": []
      },
      "acceptance_or_review": {
        "status": "not_found",
        "summary": "An acceptance or formal review process is not stated in the provided text.",
        "quotes": [],
        "sources": []
      },
      "change_control": {
        "status": "not_clearly_stated",
        "summary": "The document references changes through written Statements of Work, but does not spell out a detailed change-order process in the provided text.",
        "quotes": ["Any SOW must be in writing and signed by both parties."],
        "sources": [
          { "source_id": "src_main", "page": 2, "start_char": 200, "end_char": 275 }
        ]
      },
      "timeline_and_milestones": {
        "status": "not_found",
        "summary": "Timelines or milestones are not stated in the provided text (they may exist in the missing Statement of Work).",
        "quotes": [],
        "sources": []
      }
    },
    "payment": {
      "heading": "Payment",
      "fee_structure": {
        "status": "found",
        "summary": "Payment is structured as a flat monthly fee rather than hourly billing.",
        "quotes": ["Company will pay Contractor a monthly fee."],
        "sources": [
          { "source_id": "src_main", "page": 2, "start_char": 520, "end_char": 585 }
        ]
      },
      "rate_and_amounts": {
        "status": "found",
        "summary": "The monthly fee is $6,000.",
        "quotes": ["$6,000 per month"],
        "sources": [
          { "source_id": "src_main", "page": 2, "start_char": 586, "end_char": 610 }
        ]
      },
      "invoicing": {
        "status": "found",
        "summary": "The contractor sends an invoice at the end of each month.",
        "quotes": ["Contractor will invoice monthly in arrears."],
        "sources": [
          { "source_id": "src_main", "page": 2, "start_char": 612, "end_char": 675 }
        ]
      },
      "payment_timing": {
        "status": "found",
        "summary": "Payment is due within 15 days after receipt of an invoice.",
        "quotes": ["pay within fifteen (15) days of receipt of invoice"],
        "sources": [
          { "source_id": "src_main", "page": 2, "start_char": 676, "end_char": 745 }
        ]
      },
      "late_fees_interest": {
        "status": "found",
        "summary": "Late payments may accrue interest at 1% per month.",
        "quotes": ["interest at 1% per month"],
        "sources": [
          { "source_id": "src_main", "page": 2, "start_char": 746, "end_char": 790 }
        ]
      },
      "taxes_withholding": {
        "status": "found",
        "summary": "The contractor is responsible for taxes, and the company does not withhold payroll taxes.",
        "quotes": [
          "Contractor is responsible for all taxes.",
          "Company will not withhold payroll taxes."
        ],